{
  "$schema": "../../schemas/optional-ai-generated-contribution-v1.schema.json",
  "schema_version": 1,
  "kind": "optional-ai-generated-contribution",
  "contribution_id": "hm-20260718-001",
  "assistant_id": "hoardmind",
  "assistant_display_name": "Hoardmind",
  "model": "qwen3-coder:30b",
  "task_contract": "test-matrix-v1",
  "created_at": "2026-07-18T08:00:00.000Z",
  "base_branch": "main",
  "branch_name": "assistant/hoardmind/hm-20260718-001",
  "commit_subject": "test: add generated boundary coverage",
  "pull_request_title": "Add generated boundary coverage",
  "summary": "Adds one generated regression case for maintainer review.",
  "allowed_paths": ["apps/desktop/src/lib/example.test.ts"],
  "packet_sha256": "1111111111111111111111111111111111111111111111111111111111111111",
  "patch_sha256": "2222222222222222222222222222222222222222222222222222222222222222",
  "metrics_sha256": null,
  "human_review_required": true,
  "merge_authority": false
}
